{
  "run_id": "C_REMOTE_A40_003",
  "timestamp_utc": "2026-03-23T15:13:43Z",
  "branch": "codex/course-material-import",
  "commit_sha": "773d2bd11b390311cf938f8ee22806f9392f8cb4",
  "task": "evidence_detection",
  "track": "ED",
  "solution_family": "solution_c",
  "variant": "deberta_v3_base_single_model_remote_a40_plain_trainer_5ep",
  "status": "completed",
  "evidence_level": "local_verified",
  "objective": "Run a controlled five-epoch remote A40 baseline with isolated outputs, identify the best checkpoint, and measure whether a longer training horizon improves on C_REMOTE_A40_002.",
  "data": {
    "train_path": "training_data/train.csv",
    "dev_path": "training_data/dev.csv",
    "train_rows": 21508,
    "dev_rows": 5926
  },
  "device": {
    "requested": "auto",
    "resolved": "cuda"
  },
  "commands": {
    "train": "ssh -p 22141 -i ~/.ssh/id_ed25519 -o StrictHostKeyChecking=no -o UserKnownHostsFile=/dev/null root@194.68.245.210 'cd /workspace/NaturalLanguageUnderstandingCourseWork && ln -sf official_coursework/trial_data/ED_trial.csv test.csv && rm -rf experiments/runs/C_REMOTE_A40_003 outputs/deberta_v3_baseline_plain_trainer_5ep && mkdir -p experiments/runs/C_REMOTE_A40_003 && export SOLUTION_C_EPOCHS=5 && export SOLUTION_C_OUT_DIR=./outputs/deberta_v3_baseline_plain_trainer_5ep && export SOLUTION_C_SAVE_DIR=./outputs/deberta_v3_baseline_plain_trainer_5ep/best_model && source .venv/bin/activate && jupyter nbconvert --to notebook --execute solution_c_baseline_development.ipynb --output executed_solution_c_baseline.ipynb --output-dir experiments/runs/C_REMOTE_A40_003 --ExecutePreprocessor.timeout=0 2>&1 | tee experiments/runs/C_REMOTE_A40_003/stdout.log'",
    "evaluate": "",
    "infer": "",
    "score": ""
  },
  "artifacts": {
    "checkpoint_dir": "outputs/deberta_v3_baseline_plain_trainer_5ep/checkpoint-5380",
    "prediction_csv": "",
    "executed_notebook": "experiments/runs/C_REMOTE_A40_003/executed_solution_c_baseline.ipynb",
    "metrics_json": "experiments/runs/C_REMOTE_A40_003/result.json",
    "log_path": "experiments/runs/C_REMOTE_A40_003/stdout.log"
  },
  "metrics": {
    "accuracy": 0.8398582517718528,
    "macro_precision": 0.798090986486655,
    "macro_recall": 0.8230375698530668,
    "macro_f1": 0.8084067636084276,
    "weighted_macro_f1": null,
    "binary_precision": 0.683289124668435,
    "binary_recall": 0.7853658536585366,
    "binary_f1": 0.7307801418439717,
    "matthews_corrcoef": 0.6206273853762896,
    "threshold": null,
    "train_runtime_seconds": null,
    "eval_runtime_seconds": 13.0246,
    "infer_runtime_seconds": null,
    "peak_memory_gb": null,
    "oom_count": 0
  },
  "reference_comparison": {
    "reference_run_id": "C_REMOTE_A40_002",
    "delta_accuracy": 0.0315558555518055,
    "delta_macro_f1": 0.0380166836152818,
    "delta_matthews_corrcoef": 0.0764470673833114
  },
  "acceptance": {
    "completed_end_to_end": true,
    "artifact_reload_ok": true,
    "beats_reference": true
  },
  "notes": "Controlled five-epoch remote A40 run completed. The best checkpoint was epoch 4 / checkpoint-5380, which improved over C_REMOTE_A40_002 on accuracy, macro_f1, binary_f1, and MCC. Epoch 5 regressed, so the current optimization signal is to keep the longer run but select the epoch-4 checkpoint rather than the final epoch."
}
