{
  "run_id": "C_REMOTE_A40_005",
  "timestamp_utc": "2026-03-23T18:24:33Z",
  "branch": "codex/course-material-import",
  "commit_sha": "773d2bd11b390311cf938f8ee22806f9392f8cb4",
  "task": "evidence_detection",
  "track": "ED",
  "solution_family": "solution_c",
  "variant": "deberta_v3_base_single_model_remote_a40_lr3e5_5ep",
  "status": "completed",
  "evidence_level": "local_verified",
  "objective": "Run a single-variable learning-rate experiment on the remote A40 by lowering Solution C to lr=3e-5 while keeping the linear scheduler and five-epoch best-checkpoint selection unchanged.",
  "data": {
    "train_path": "training_data/train.csv",
    "dev_path": "training_data/dev.csv",
    "train_rows": 21508,
    "dev_rows": 5926
  },
  "device": {
    "requested": "auto",
    "resolved": "cuda"
  },
  "commands": {
    "train": "ssh -p 22141 -i ~/.ssh/id_ed25519 -o StrictHostKeyChecking=no root@194.68.245.210 'cd /workspace/NaturalLanguageUnderstandingCourseWork && ln -sf official_coursework/trial_data/ED_trial.csv test.csv && source .venv/bin/activate && mkdir -p experiments/runs/C_REMOTE_A40_005 && export SOLUTION_C_EPOCHS=5 && export SOLUTION_C_LR=3e-5 && export SOLUTION_C_LR_SCHEDULER=linear && export SOLUTION_C_OUT_DIR=./outputs/deberta_v3_baseline_plain_trainer_5ep_lr3e5 && export SOLUTION_C_SAVE_DIR=./outputs/deberta_v3_baseline_plain_trainer_5ep_lr3e5/best_model && jupyter nbconvert --to notebook --execute solution_c_baseline_development.ipynb --output executed_solution_c_baseline.ipynb --output-dir experiments/runs/C_REMOTE_A40_005 --ExecutePreprocessor.timeout=0 2>&1 | tee experiments/runs/C_REMOTE_A40_005/stdout.log'",
    "evaluate": "ssh -p 22141 -i ~/.ssh/id_ed25519 -o StrictHostKeyChecking=no root@194.68.245.210 'cd /workspace/NaturalLanguageUnderstandingCourseWork && mkdir -p experiments/runs/C_REMOTE_A40_005_probe && .venv/bin/python experiments/debug/solution_c_eval_probe.py --model-dir outputs/deberta_v3_baseline_plain_trainer_5ep_lr3e5/best_model --data-csv training_data/dev.csv --batch-size 32 --max-length 256 --json-out experiments/runs/C_REMOTE_A40_005_probe/result.json --predictions-out experiments/runs/C_REMOTE_A40_005_probe/dev_predictions.csv'",
    "infer": "",
    "score": ""
  },
  "artifacts": {
    "checkpoint_dir": "outputs/deberta_v3_baseline_plain_trainer_5ep_lr3e5/checkpoint-5380",
    "prediction_csv": "experiments/runs/C_REMOTE_A40_005_probe/dev_predictions.csv",
    "executed_notebook": "experiments/runs/C_REMOTE_A40_005/executed_solution_c_baseline.ipynb",
    "metrics_json": "experiments/runs/C_REMOTE_A40_005/result.json",
    "log_path": "experiments/runs/C_REMOTE_A40_005/stdout.log"
  },
  "metrics": {
    "accuracy": 0.8290583867701654,
    "macro_precision": 0.7861924702378074,
    "macro_recall": 0.815759620090368,
    "macro_f1": 0.797640748092777,
    "weighted_macro_f1": null,
    "binary_precision": 0.6606868272680677,
    "binary_recall": 0.7859756097560976,
    "binary_f1": 0.7179058758006126,
    "matthews_corrcoef": 0.6012255007067282,
    "threshold": null,
    "train_runtime_seconds": null,
    "eval_runtime_seconds": null,
    "infer_runtime_seconds": null,
    "peak_memory_gb": null,
    "oom_count": 0
  },
  "reference_comparison": {
    "reference_run_id": "C_REMOTE_A40_003",
    "delta_accuracy": -0.0107998650016874,
    "delta_macro_f1": -0.0107660155156506,
    "delta_matthews_corrcoef": -0.0194018846695614
  },
  "acceptance": {
    "completed_end_to_end": true,
    "artifact_reload_ok": true,
    "beats_reference": false
  },
  "notes": "Lowering the learning rate to 3e-5 completed cleanly on the remote A40 and still selected epoch 4 / checkpoint-5380 as the best checkpoint, but the direct evaluation probe showed clear regression against C_REMOTE_A40_003 on accuracy, macro_f1, binary_f1, and MCC."
}
